{
  "schema_version": "1.0.0",
  "command": "hf config list",
  "run_id": "cfg_list_20260406_a1b2c3d4",
  "status": "ok",
  "generated_at": "2026-04-06T10:00:00+00:00",
  "source": "system",
  "advice_only": false,
  "decision_weight": 1,
  "data": {
    "configs": [
      {
        "config_id": "a1b2c3d4-0000-0000-0000-000000000000",
        "params_count": 33,
        "note": "daily_run",
        "created_at": "2026-04-06T08:00:00+00:00",
        "layers": ["l2", "l4", "l5", "l5.5", "l6", "l7"]
      }
    ]
  },
  "warnings": [],
  "errors": []
}
