{
  "schema_version": "1.0.0",
  "command": "hf pretrade check",
  "run_id": "run_20260406_pretrade01",
  "status": "ok",
  "generated_at": "2026-04-06T10:00:00+00:00",
  "source": "system",
  "advice_only": false,
  "decision_weight": 1,
  "data": {
    "as_of": "2026-04-01",
    "notional": 1000000.0,
    "overall_tradable": true,
    "total_impact_bp": 8.3,
    "orders": [
      {
        "symbol": "600519.SH",
        "target_weight": 0.12,
        "target_notional": 120000.0,
        "adv": 850000000.0,
        "participation_rate": 0.0001411764705882353,
        "sigma": 0.18,
        "impact_bp": 2.1,
        "tradable": true
      },
      {
        "symbol": "300750.SZ",
        "target_weight": 0.1,
        "target_notional": 100000.0,
        "adv": 320000000.0,
        "participation_rate": 0.0003125,
        "sigma": 0.24,
        "impact_bp": 3.8,
        "tradable": true
      }
    ]
  },
  "warnings": [],
  "errors": []
}
