{
  "schema_version": "1.0.0",
  "command": "hf config get",
  "run_id": "cfg_get_20260406_a1b2c3d4",
  "status": "ok",
  "generated_at": "2026-04-06T10:00:00+00:00",
  "source": "system",
  "advice_only": false,
  "decision_weight": 1,
  "data": {
    "config_id": "a1b2c3d4-0000-0000-0000-000000000000",
    "note": "daily_run",
    "created_at": "2026-04-06T08:00:00+00:00",
    "params": [
      {"layer": "l5.5", "param_key": "eta", "param_value": 0.1},
      {"layer": "l6", "param_key": "slippage_bp", "param_value": 5.0}
    ]
  },
  "warnings": [],
  "errors": []
}
